Content Title,Section,Content Type,Status,Priority,Last Updated,Keywords,Content
Transform Your Business with AI-Powered SaaS Solutions,Home,Hero,Published,High,"September 1, 2025","AI, Cloud Computing, Machine Learning, SaaS","At AIVENTURE LABS, we revolutionize SaaS solutions with cutting-edge AI integration. Our expert team combines advanced machine learning algorithms with functional programming excellence to deliver scalable, efficient, and intelligent software that drives your business forward."
Why Choose AIVENTURE LABS?,About,Section Header,Published,High,"August 31, 2025","AI, Functional Programming, SaaS, Scala, ZIO","What sets us apart is our unique combination of AI expertise and functional programming excellence. While many consultancies focus on either AI or software development, we bring both worlds together to create truly intelligent, robust applications. Our team stays at the cutting edge of technology while maintaining a practical focus on delivering business value through stable, maintainable solutions."
AI Integration Services,Services,Service Description,Published,High,"August 30, 2025","AI, Cloud Computing, Machine Learning, SaaS","Our AI Integration services help businesses embed intelligent features into existing software or build new AI-powered solutions from the ground up. We specialize in natural language processing, predictive analytics, recommendation systems, and computer vision to create applications that learn, adapt, and deliver exceptional value to your customers."
About AIVENTURE LABS,About,Paragraph,Published,High,"August 29, 2025","AI, Functional Programming, SaaS, Scala, ZIO","AIVENTURE LABS LLC was founded with a clear mission: to bridge the gap between traditional SaaS solutions and the limitless potential of artificial intelligence. Our team of seasoned developers, data scientists, and technology strategists work together to create intelligent software that solves real business problems. With expertise in Scala, ZIO, and functional programming paradigms, we build resilient, scalable systems that stand the test of time."
Fractional CTO Services,Services,Service Description,Published,High,"August 28, 2025","Cloud Computing, DevOps, Fractional CTO, Software Architecture","Access executive-level technology leadership without the full-time cost. Our Fractional CTO service provides strategic guidance, technical roadmapping, architecture planning, and team leadership to help your business make informed technology decisions. We bridge the gap between business objectives and technical implementation to ensure your technology investments deliver maximum ROI."
Contact AIVENTURE LABS,Contact,Contact Info,Published,Medium,"August 31, 2025","AI, Fractional CTO, SaaS, Software Architecture","Ready to transform your business with AI-powered solutions? Our team is eager to learn about your challenges and opportunities. Reach out today to schedule a consultation, request a proposal, or simply learn more about how we can help your organization leverage the power of AI and functional programming."
ZIO Consultancy: Effect-Oriented Programming,Services,Service Description,Published,Medium,"August 27, 2025","Functional Programming, Scala, Software Architecture, ZIO","Harness the power of ZIO to build highly concurrent, resilient applications. Our ZIO consultancy services help teams adopt this powerful Scala library for effect management, resulting in code that's easier to test, maintain, and reason about. We offer training, implementation support, and codebase modernization to help you leverage ZIO's full potential."
Our Technology Stack,About,Paragraph,Published,Medium,"August 26, 2025","Cloud Computing, DevOps, Functional Programming, Scala, ZIO","We specialize in building scalable, maintainable systems using modern technology stacks. Our core expertise includes Scala, ZIO, Cats Effect, Akka, and other functional programming libraries. For AI development, we leverage PyTorch, TensorFlow, scikit-learn, and custom ML pipelines. Our cloud infrastructure expertise spans AWS, Google Cloud, and Azure, ensuring your solutions are scalable, secure, and cost-effective."
Scala and Functional Programming Excellence,Services,Service Description,Published,Medium,"August 25, 2025","Functional Programming, Scala, Software Architecture","Functional programming delivers cleaner, more maintainable code with fewer bugs. Our Scala consultancy services help teams adopt functional programming practices, refactor legacy codebases, and build new applications using FP principles. From basic training to advanced techniques, we'll help your team leverage the full power of Scala and functional programming."
Frequently Asked Questions,FAQ,FAQ,Published,Low,"August 24, 2025","AI, Fractional CTO, SaaS, Scala, ZIO","Find answers to common questions about our services, technology approach, and engagement models. Learn about AI integration timelines, the benefits of functional programming, how our Fractional CTO service works, and more."